g++  -O2 -Wall -I. -I/home/yoshitar/packages/lhapdf_v6.1.5/include -I/home/yoshitar/packages/Hathor_v2.0/include -o myprogram myprogram.cxx -L /home/yoshitar/packages/Hathor_v2.0/lib -lHathor -L /home/yoshitar/packages/lhapdf_v6.1.5/lib -lLHAPDF -lff   -lgfortranbegin -lgfortran -lm
LHAPDF 6.1.5 loading all 41 PDFs in set MSTW2008nlo68cl
MSTW2008nlo68cl, version 2; 41 PDF members
 HATHOR: Dear user,
 HATHOR: please note that per default the exact NNLO results [1-4] are used
 HATHOR: for the evaluation of the inclusive cross section
 HATHOR: The weak corrections are based on [5-7]
 HATHOR: For the numerical integration Hathor uses an adopted version 
 HATHOR: of the Vegas integrator [8,9]. The required random numbers are 
 HATHOR: generated using Ranlux [10]. The one-loop integrals are calculated
 HATHOR: using the FF library. [11]
 HATHOR: [1]  Baernreuther, Czakon, Mitov: Percent level precision physics at 
 HATHOR:      the Tevatron: first genuine NNLO QCD corrections to 
 HATHOR:      q qbar -> t tbar + X,  Phys.Rev.Lett. 109 (2012) 132001.
 HATHOR: [2]  Czakon, Mitov: NNLO corrections to top-pair production at 
 HATHOR:      hadron colliders: the all-fermionic scattering channels,
 HATHOR:      JHEP 1212 (2012) 054
 HATHOR: [3]  Czakon, Mitov: NNLO corrections to top pair production at
 HATHOR:      hadron colliders: the quark-gluon reaction,
 HATHOR:      JHEP 1301 (2013) 080
 HATHOR: [4]  Czakon, Fiedler, Mitov: The total top quark pair production 
 HATHOR:      cross-section at hadron colliders through O(alpha_S^4),
 HATHOR:      Phys.Rev.Lett. 110 (2013) 25, 252004
 HATHOR: [5]  K¨uhn, Scharf and Uwer: Electroweak corrections to
 HATHOR:      top-quark pair production in quark-antiquark annihilation
 HATHOR:      Eur. Phys. J. C 45 (2006) 139 [hep-ph/0508092].
 HATHOR: [6]  K¨uhn, Scharf and Uwer: Electroweak effects in
 HATHOR:      top-quark pair production at hadron colliders,
 HATHOR:      Eur. Phys. J. C 51 (2007) 37 [hep-ph/0610335].
 HATHOR: [7]  K¨uhn, Scharf and Uwer: Weak Interactions in
 HATHOR:      Top-Quark Pair Production at Hadron Colliders: An Update,
 HATHOR:      arXiv:1305.5773 [hep-ph].
 HATHOR: [8]  Lepage:A New Algorithm for Adaptive Multidimensional Integration
 HATHOR:      J.Comput.Phys.27 (1978) 192
 HATHOR: [9] Lepage: VEGAS: AN ADAPTIVE MULTIDIMENSIONAL INTEGRATION PROGRAM
 HATHOR:      CLNS-80/447 (1980).
 HATHOR: [10] Luescher: A Portable high quality random number generator
 HATHOR:      for lattice field theory simulations,
 HATHOR:      Comput.Phys.Commun.79 (1994) 100 [hep-lat/930902]
 HATHOR: [11] van Oldenborgh: FF: A Package to evaluate one loop
 HATHOR:      Feynman diagrams, Comput.Phys.Commun 66 (1991) 1
 HATHOR: 
 HATHOR: Please cite the corresponding articles if you quote Hathor results
 HATHOR: in your article relying on the aformentioned calculations.
 HATHOR: Collider set to Proton-Proton
 HATHOR: sqrt(shad) is set to [GeV]:  8000
 HATHOR: Change if needed with setSqrtShad(newval)
 HATHOR: Collider energy set to [GeV]:  8000
 HATHOR: Precision set to  10000
 HATHOR: Precision set to  1000
0.0933074 0.182422 2.04679e-05 0.00969707 -0.00953783 (pdf)
 FF: ====================================================
 FF:   FF 2.0, a package to evaluate one-loop integrals
 FF: written by G. J. van Oldenborgh, NIKHEF-H, Amsterdam
 FF: ====================================================
 FF: for the algorithms used see preprint NIKHEF-H 89/17,
 FF: New Algorithms for One-loop Integrals, by G.J. van
 FF: Oldenborgh and J.A.M. Vermaseren, published in 
 FF: Zeitschrift fuer Physik C46(1990)425.
 FF: ====================================================
 FF: ffini: precx = .177635683940025E-14
 FF: ffini: precc = .177635683940025E-14
 FF: ffini: xalogm = .100000000000000-299
 FF: ffini: xclogm = .100000000000000-299
************************************************************
*                                                          *
*                      W E L C O M E to                    *
*             M A D G R A P H 5 _ a M C @ N L O            *
*                      M A D E V E N T                     *
*                                                          *
*                 *                       *                *
*                   *        * *        *                  *
*                     * * * * 5 * * * *                    *
*                   *        * *        *                  *
*                 *                       *                *
*                                                          *
*         VERSION 5.2.3.0.beta                             *
*                                                          *
*    The MadGraph5_aMC@NLO Development Team - Find us at   *
*    https://server06.fynu.ucl.ac.be/projects/madgraph     *
*                                                          *
*               Type 'help' for in-line help.              *
*                                                          *
************************************************************
INFO: load configuration from /home/yoshitar/projects/z2j/MG5/pp_bpbp~_dzd~z/Cards/me5_configuration.txt  
INFO: load configuration from /home/yoshitar/packages/MG5_aMC_v2.3.0.beta/input/mg5_configuration.txt  
INFO: load configuration from /home/yoshitar/projects/z2j/MG5/pp_bpbp~_dzd~z/Cards/me5_configuration.txt  
Using default text editor "vi". Set another one in ./input/mg5_configuration.txt
Using default eps viewer "evince". Set another one in ./input/mg5_configuration.txt
Using default web browser "firefox". Set another one in ./input/mg5_configuration.txt
No valid Delphes path found
generate_events m_600_0.8_10k -f
Generating 10000 events with run name m_600_0.8_10k
survey  m_600_0.8_10k 
INFO: compile directory 
compile Source Directory
Error: no display specified
Using random number seed offset = 30
INFO: Running Survey 
Creating Jobs
Working on SubProcesses
INFO:     P0_gg_bpbpx_bp_qz_bpx_qz  
INFO:     P0_qq_bpbpx_bp_qz_bpx_qz  
INFO:  Idle: 1,  Running: 1,  Completed: 0 [ current time: 21h59 ] 
INFO:  Idle: 0,  Running: 1,  Completed: 1 [  6.2s  ] 
INFO:  Idle: 0,  Running: 0,  Completed: 2 [  12.3s  ] 
INFO:  Idle: 0,  Running: 0,  Completed: 2 [  12.4s  ] 
INFO: End survey 
refine 10000
Creating Jobs
INFO: Refine results to 10000 
INFO: Generating 10000.0 unweigthed events. 
INFO: Effective Luminosity 1989719.78113 pb^-1 
INFO: need to improve 3 channels 
Current estimate of cross-section: 0.006031 +- 7.88367946505e-05
    P0_gg_bpbpx_bp_qz_bpx_qz 
    P0_qq_bpbpx_bp_qz_bpx_qz 
INFO:  Idle: 0,  Running: 3,  Completed: 0 [ current time: 21h59 ] 
INFO:  Idle: 0,  Running: 2,  Completed: 1 [  23.2s  ] 
INFO:  Idle: 0,  Running: 1,  Completed: 2 [  50s  ] 
INFO:  Idle: 0,  Running: 0,  Completed: 3 [  1m 14s  ] 
INFO:  Idle: 0,  Running: 0,  Completed: 3 [  1m 14s  ] 
INFO: Combining runs 
INFO: finish refine 
refine 10000
Creating Jobs
INFO: Refine results to 10000 
INFO: Generating 10000.0 unweigthed events. 
INFO: Effective Luminosity 1962413.24498 pb^-1 
INFO: need to improve 0 channels 
Current estimate of cross-section: 0.00611492 +- 1.79704141455e-05
    P0_gg_bpbpx_bp_qz_bpx_qz 
    P0_qq_bpbpx_bp_qz_bpx_qz 
INFO:  Idle: 0,  Running: 0,  Completed: 0 [ current time: 22h00 ] 
INFO: Combining runs 
INFO: finish refine 
combine_events
INFO: Combining Events 
  === Results Summary for run: m_600_0.8_10k tag: tag_1 ===

     Cross-section :   0.006115 +- 1.797e-05 pb
     Nb of events :  10000
 
running syscalc on mode parton
store_events
INFO: Storing parton level results 
INFO: End Parton 
reweight -from_cards
decay_events -from_cards
INFO: Running Pythia 
INFO: Creating shower LHE File (for plot) 
INFO: Warning! Never use this lhe file for detector studies! 
running syscalc on mode Pythia
INFO: finish 
INFO: No pgs_card detected, so not run pgs 
  === Results Summary for run: m_600_0.8_10k tag: tag_1 ===

     Cross-section :   0.006115 +- 1.797e-05 pb
     Nb of events :  10000
 
INFO: storring files of Previous run 
INFO: Storing Pythia files of Previous run 
INFO: Done 
quit
INFO:  
 
INFO:  
 
launch in debug mode

Test: Calculation of r = signal/(95%CL limit on signal)
Warning: Error is dominated by Monte Carlo statistics!
Result: Excluded
Result for r: r_max = 2.38533
SR: atlas_1405_7875 - SR04_5j
Traceback (most recent call last):
  File "get_checkmate_results.py", line 7, in <module>
    ld = open("/Users/yoshi/packages/checkmate_v1.2.1/results/output/evaluation/best_signal_regions.txt")
IOError: [Errno 2] No such file or directory: '/Users/yoshi/packages/checkmate_v1.2.1/results/output/evaluation/best_signal_regions.txt'
cat: s.tmp: No such file or directory
mkdir: cannot create directory `results_local_test/atlas_1405_7875_600': No such file or directory
mv: cannot move `/home/yoshitar/packages/CheckMATE-1.2.2/results/output' to `results_local_test/atlas_1405_7875_600/zz': No such file or directory
mv: cannot move `s_zz.dat' to `results_local_test/atlas_1405_7875_600/.': No such file or directory
g++  -O2 -Wall -I. -I/home/yoshitar/packages/lhapdf_v6.1.5/include -I/home/yoshitar/packages/Hathor_v2.0/include -o myprogram myprogram.cxx -L /home/yoshitar/packages/Hathor_v2.0/lib -lHathor -L /home/yoshitar/packages/lhapdf_v6.1.5/lib -lLHAPDF -lff   -lgfortranbegin -lgfortran -lm
LHAPDF 6.1.5 loading all 41 PDFs in set MSTW2008nlo68cl
MSTW2008nlo68cl, version 2; 41 PDF members
 HATHOR: Dear user,
 HATHOR: please note that per default the exact NNLO results [1-4] are used
 HATHOR: for the evaluation of the inclusive cross section
 HATHOR: The weak corrections are based on [5-7]
 HATHOR: For the numerical integration Hathor uses an adopted version 
 HATHOR: of the Vegas integrator [8,9]. The required random numbers are 
 HATHOR: generated using Ranlux [10]. The one-loop integrals are calculated
 HATHOR: using the FF library. [11]
 HATHOR: [1]  Baernreuther, Czakon, Mitov: Percent level precision physics at 
 HATHOR:      the Tevatron: first genuine NNLO QCD corrections to 
 HATHOR:      q qbar -> t tbar + X,  Phys.Rev.Lett. 109 (2012) 132001.
 HATHOR: [2]  Czakon, Mitov: NNLO corrections to top-pair production at 
 HATHOR:      hadron colliders: the all-fermionic scattering channels,
 HATHOR:      JHEP 1212 (2012) 054
 HATHOR: [3]  Czakon, Mitov: NNLO corrections to top pair production at
 HATHOR:      hadron colliders: the quark-gluon reaction,
 HATHOR:      JHEP 1301 (2013) 080
 HATHOR: [4]  Czakon, Fiedler, Mitov: The total top quark pair production 
 HATHOR:      cross-section at hadron colliders through O(alpha_S^4),
 HATHOR:      Phys.Rev.Lett. 110 (2013) 25, 252004
 HATHOR: [5]  K¨uhn, Scharf and Uwer: Electroweak corrections to
 HATHOR:      top-quark pair production in quark-antiquark annihilation
 HATHOR:      Eur. Phys. J. C 45 (2006) 139 [hep-ph/0508092].
 HATHOR: [6]  K¨uhn, Scharf and Uwer: Electroweak effects in
 HATHOR:      top-quark pair production at hadron colliders,
 HATHOR:      Eur. Phys. J. C 51 (2007) 37 [hep-ph/0610335].
 HATHOR: [7]  K¨uhn, Scharf and Uwer: Weak Interactions in
 HATHOR:      Top-Quark Pair Production at Hadron Colliders: An Update,
 HATHOR:      arXiv:1305.5773 [hep-ph].
 HATHOR: [8]  Lepage:A New Algorithm for Adaptive Multidimensional Integration
 HATHOR:      J.Comput.Phys.27 (1978) 192
 HATHOR: [9] Lepage: VEGAS: AN ADAPTIVE MULTIDIMENSIONAL INTEGRATION PROGRAM
 HATHOR:      CLNS-80/447 (1980).
 HATHOR: [10] Luescher: A Portable high quality random number generator
 HATHOR:      for lattice field theory simulations,
 HATHOR:      Comput.Phys.Commun.79 (1994) 100 [hep-lat/930902]
 HATHOR: [11] van Oldenborgh: FF: A Package to evaluate one loop
 HATHOR:      Feynman diagrams, Comput.Phys.Commun 66 (1991) 1
 HATHOR: 
 HATHOR: Please cite the corresponding articles if you quote Hathor results
 HATHOR: in your article relying on the aformentioned calculations.
 HATHOR: Collider set to Proton-Proton
 HATHOR: sqrt(shad) is set to [GeV]:  8000
 HATHOR: Change if needed with setSqrtShad(newval)
 HATHOR: Collider energy set to [GeV]:  8000
 HATHOR: Precision set to  10000
 HATHOR: Precision set to  1000
0.0933074 0.182422 2.04679e-05 0.00969707 -0.00953783 (pdf)
 FF: ====================================================
 FF:   FF 2.0, a package to evaluate one-loop integrals
 FF: written by G. J. van Oldenborgh, NIKHEF-H, Amsterdam
 FF: ====================================================
 FF: for the algorithms used see preprint NIKHEF-H 89/17,
 FF: New Algorithms for One-loop Integrals, by G.J. van
 FF: Oldenborgh and J.A.M. Vermaseren, published in 
 FF: Zeitschrift fuer Physik C46(1990)425.
 FF: ====================================================
 FF: ffini: precx = .177635683940025E-14
 FF: ffini: precc = .177635683940025E-14
 FF: ffini: xalogm = .100000000000000-299
 FF: ffini: xclogm = .100000000000000-299
************************************************************
*                                                          *
*                      W E L C O M E to                    *
*             M A D G R A P H 5 _ a M C @ N L O            *
*                      M A D E V E N T                     *
*                                                          *
*                 *                       *                *
*                   *        * *        *                  *
*                     * * * * 5 * * * *                    *
*                   *        * *        *                  *
*                 *                       *                *
*                                                          *
*         VERSION 5.2.3.0.beta                             *
*                                                          *
*    The MadGraph5_aMC@NLO Development Team - Find us at   *
*    https://server06.fynu.ucl.ac.be/projects/madgraph     *
*                                                          *
*               Type 'help' for in-line help.              *
*                                                          *
************************************************************
INFO: load configuration from /home/yoshitar/projects/z2j/MG5/pp_bpbp~_dzd~z/Cards/me5_configuration.txt  
INFO: load configuration from /home/yoshitar/packages/MG5_aMC_v2.3.0.beta/input/mg5_configuration.txt  
INFO: load configuration from /home/yoshitar/projects/z2j/MG5/pp_bpbp~_dzd~z/Cards/me5_configuration.txt  
Using default text editor "vi". Set another one in ./input/mg5_configuration.txt
Using default eps viewer "evince". Set another one in ./input/mg5_configuration.txt
Using default web browser "firefox". Set another one in ./input/mg5_configuration.txt
No valid Delphes path found
generate_events m_600_0.8_10k -f
Generating 10000 events with run name m_600_0.8_10k
survey  m_600_0.8_10k 
INFO: compile directory 
compile Source Directory
Error: no display specified
Using random number seed offset = 39
INFO: Running Survey 
Creating Jobs
Working on SubProcesses
INFO:     P0_gg_bpbpx_bp_qz_bpx_qz  
INFO:     P0_qq_bpbpx_bp_qz_bpx_qz  
INFO:  Idle: 1,  Running: 1,  Completed: 0 [ current time: 22h11 ] 
INFO:  Idle: 0,  Running: 1,  Completed: 1 [  6.4s  ] 
INFO:  Idle: 0,  Running: 0,  Completed: 2 [  13.3s  ] 
INFO:  Idle: 0,  Running: 0,  Completed: 2 [  13.3s  ] 
INFO: End survey 
refine 10000
Creating Jobs
INFO: Refine results to 10000 
INFO: Generating 10000.0 unweigthed events. 
INFO: Effective Luminosity 1932737.51331 pb^-1 
INFO: need to improve 3 channels 
Current estimate of cross-section: 0.00620881 +- 6.96012274525e-05
    P0_gg_bpbpx_bp_qz_bpx_qz 
    P0_qq_bpbpx_bp_qz_bpx_qz 
INFO:  Idle: 1,  Running: 2,  Completed: 0 [ current time: 22h11 ] 
INFO:  Idle: 0,  Running: 2,  Completed: 1 [  12.3s  ] 
INFO:  Idle: 0,  Running: 1,  Completed: 2 [  1m 8s  ] 
INFO:  Idle: 0,  Running: 0,  Completed: 3 [  1m 32s  ] 
INFO:  Idle: 0,  Running: 0,  Completed: 3 [  1m 32s  ] 
INFO: Combining runs 
INFO: finish refine 
refine 10000
Creating Jobs
INFO: Refine results to 10000 
INFO: Generating 10000.0 unweigthed events. 
INFO: Effective Luminosity 1956114.56963 pb^-1 
INFO: need to improve 0 channels 
Current estimate of cross-section: 0.00613461 +- 1.28091807931e-05
    P0_gg_bpbpx_bp_qz_bpx_qz 
    P0_qq_bpbpx_bp_qz_bpx_qz 
INFO:  Idle: 0,  Running: 0,  Completed: 0 [ current time: 22h13 ] 
INFO: Combining runs 
INFO: finish refine 
combine_events
INFO: Combining Events 
  === Results Summary for run: m_600_0.8_10k tag: tag_1 ===

     Cross-section :   0.006135 +- 1.281e-05 pb
     Nb of events :  10000
 
running syscalc on mode parton
store_events
INFO: Storing parton level results 
INFO: End Parton 
reweight -from_cards
decay_events -from_cards
INFO: Running Pythia 
INFO: Creating shower LHE File (for plot) 
INFO: Warning! Never use this lhe file for detector studies! 
running syscalc on mode Pythia
INFO: finish 
INFO: No pgs_card detected, so not run pgs 
  === Results Summary for run: m_600_0.8_10k tag: tag_1 ===

     Cross-section :   0.006135 +- 1.281e-05 pb
     Nb of events :  10000
 
INFO: storring files of Previous run 
INFO: Storing Pythia files of Previous run 
INFO: Done 
quit
INFO:  
 
INFO:  
 
launch in debug mode

Test: Calculation of r = signal/(95%CL limit on signal)
Warning: Error is dominated by Monte Carlo statistics!
Result: Excluded
Result for r: r_max = 2.19253
SR: atlas_1405_7875 - SR05_d.6jt+
Traceback (most recent call last):
  File "get_checkmate_results.py", line 7, in <module>
    ld = open("/Users/yoshi/packages/checkmate_v1.2.1/results/output/evaluation/best_signal_regions.txt")
IOError: [Errno 2] No such file or directory: '/Users/yoshi/packages/checkmate_v1.2.1/results/output/evaluation/best_signal_regions.txt'
cat: s.tmp: No such file or directory
mkdir: cannot create directory `results_local_test/atlas_1405_7875_600': No such file or directory
mv: cannot move `/home/yoshitar/packages/CheckMATE-1.2.2/results/output' to `results_local_test/atlas_1405_7875_600/zz': No such file or directory
mv: cannot move `s_zz.dat' to `results_local_test/atlas_1405_7875_600/.': No such file or directory
************************************************************
*                                                          *
*                      W E L C O M E to                    *
*             M A D G R A P H 5 _ a M C @ N L O            *
*                      M A D E V E N T                     *
*                                                          *
*                 *                       *                *
*                   *        * *        *                  *
*                     * * * * 5 * * * *                    *
*                   *        * *        *                  *
*                 *                       *                *
*                                                          *
*         VERSION 5.2.3.0.beta                             *
*                                                          *
*    The MadGraph5_aMC@NLO Development Team - Find us at   *
*    https://server06.fynu.ucl.ac.be/projects/madgraph     *
*                                                          *
*               Type 'help' for in-line help.              *
*                                                          *
************************************************************
INFO: load configuration from /home/yoshitar/projects/z2j/MG5/pp_bpbp~_dzuw/Cards/me5_configuration.txt  
INFO: load configuration from /home/yoshitar/packages/MG5_aMC_v2.3.0.beta/input/mg5_configuration.txt  
INFO: load configuration from /home/yoshitar/projects/z2j/MG5/pp_bpbp~_dzuw/Cards/me5_configuration.txt  
Using default text editor "vi". Set another one in ./input/mg5_configuration.txt
Using default eps viewer "evince". Set another one in ./input/mg5_configuration.txt
Using default web browser "firefox". Set another one in ./input/mg5_configuration.txt
No valid Delphes path found
generate_events m_600_0.8_10k -f
INFO: Computing the width set on auto in the param_card.dat 
INFO: load particles 
INFO: load vertices 
INFO: Change particles name to pass to MG5 convention 
************************************************************
*                                                          *
*                     W E L C O M E to                     *
*              M A D G R A P H 5 _ a M C @ N L O           *
*                                                          *
*                                                          *
*                 *                       *                *
*                   *        * *        *                  *
*                     * * * * 5 * * * *                    *
*                   *        * *        *                  *
*                 *                       *                *
*                                                          *
*         VERSION 2.3.0.beta            2015-04-10         *
*                                                          *
*    The MadGraph5_aMC@NLO Development Team - Find us at   *
*    https://server06.fynu.ucl.ac.be/projects/madgraph     *
*                            and                           *
*            http://amcatnlo.web.cern.ch/amcatnlo/         *
*                                                          *
*               Type 'help' for in-line help.              *
*           Type 'tutorial' to learn how MG5 works         *
*    Type 'tutorial aMCatNLO' to learn how aMC@NLO works   *
*    Type 'tutorial MadLoop' to learn how MadLoop works    *
*                                                          *
************************************************************
load MG5 configuration from ../../../../packages/MG5_aMC_v2.3.0.beta/input/mg5_configuration.txt 
set fastjet to fastjet-config
set lhapdf to lhapdf-config
Using default text editor "vi". Set another one in ./input/mg5_configuration.txt
Using default eps viewer "evince". Set another one in ./input/mg5_configuration.txt
Using default web browser "firefox". Set another one in ./input/mg5_configuration.txt
set automatic_html_opening False --no_save
compute_widths 6000007 --precision_channel=0.01 --body_decay=4.0025 --path=/home/yoshitar/projects/z2j/MG5/pp_bpbp~_dzuw/Cards/param_card.dat --output=/home/yoshitar/projects/z2j/MG5/pp_bpbp~_dzuw/Cards/param_card.dat
[1;34mBe carefull automatic computation of the width is
ONLY valid in Narrow-Width Approximation and at Tree-Level.[0m
INFO: get decay diagram for bp 
Vertexlist of this model has not been searched.Automatically run the model.find_vertexlist()
Found 1 stable particles
Pass to numerical integration for computing the widths:
INFO: More info in temporary files:
    /home/yoshitar/projects/z2j/MG5/pp_bpbp~_dzuw/tmpml5oK5/temp_decay/index.html 
Results written to /home/yoshitar/projects/z2j/MG5/pp_bpbp~_dzuw/Cards/param_card.dat
Generating 10000 events with run name m_600_0.8_10k
survey  m_600_0.8_10k 
INFO: compile directory 
Error: no display specified
compile Source Directory
Using random number seed offset = 21
INFO: Running Survey 
Creating Jobs
Working on SubProcesses
INFO:     P1_gg_bpbpx_bp_qz_bpx_qwp  
INFO:     P1_qq_bpbpx_bp_qz_bpx_qwp  
INFO:     P2_gg_bpbpx_bp_qwm_bpx_qz  
INFO:     P2_qq_bpbpx_bp_qwm_bpx_qz  
INFO:  Idle: 1,  Running: 3,  Completed: 2 [ current time: 22h23 ] 
INFO:  Idle: 0,  Running: 4,  Completed: 2 [ current time: 22h23 ] 
INFO:  Idle: 0,  Running: 3,  Completed: 3 [  4.1s  ] 
INFO:  Idle: 0,  Running: 2,  Completed: 4 [  7.7s  ] 
INFO:  Idle: 0,  Running: 0,  Completed: 6 [  15.4s  ] 
INFO:  Idle: 0,  Running: 0,  Completed: 6 [  15.4s  ] 
INFO: End survey 
refine 10000
Creating Jobs
INFO: Refine results to 10000 
INFO: Generating 10000.0 unweigthed events. 
INFO: Effective Luminosity 757438.997757 pb^-1 
INFO: need to improve 7 channels 
Current estimate of cross-section: 0.01584286 +- 0.0011839106996
    P1_gg_bpbpx_bp_qz_bpx_qwp 
    P1_qq_bpbpx_bp_qz_bpx_qwp 
    P2_gg_bpbpx_bp_qwm_bpx_qz 
    P2_qq_bpbpx_bp_qwm_bpx_qz 
INFO:  Idle: 0,  Running: 7,  Completed: 0 [ current time: 22h23 ] 
INFO:  Idle: 0,  Running: 6,  Completed: 1 [  12.7s  ] 
INFO:  Idle: 0,  Running: 3,  Completed: 4 [  24.9s  ] 
INFO:  Idle: 0,  Running: 1,  Completed: 6 [  31.5s  ] 
INFO:  Idle: 0,  Running: 0,  Completed: 7 [  2m 1s  ] 
INFO:  Idle: 0,  Running: 0,  Completed: 7 [  2m 1s  ] 
INFO: Combining runs 
INFO: finish refine 
refine 10000
Creating Jobs
INFO: Refine results to 10000 
INFO: Generating 10000.0 unweigthed events. 
INFO: Effective Luminosity 731060.506832 pb^-1 
INFO: need to improve 0 channels 
Current estimate of cross-section: 0.01641451 +- 4.03394713401e-05
    P1_gg_bpbpx_bp_qz_bpx_qwp 
    P1_qq_bpbpx_bp_qz_bpx_qwp 
    P2_gg_bpbpx_bp_qwm_bpx_qz 
    P2_qq_bpbpx_bp_qwm_bpx_qz 
INFO:  Idle: 0,  Running: 0,  Completed: 0 [ current time: 22h25 ] 
INFO: Combining runs 
INFO: finish refine 
combine_events
INFO: Combining Events 
  === Results Summary for run: m_600_0.8_10k tag: tag_1 ===

     Cross-section :   0.01641 +- 4.034e-05 pb
     Nb of events :  10000
 
running syscalc on mode parton
store_events
INFO: Storing parton level results 
INFO: End Parton 
reweight -from_cards
decay_events -from_cards
INFO: Running Pythia 
INFO: Creating shower LHE File (for plot) 
INFO: Warning! Never use this lhe file for detector studies! 
running syscalc on mode Pythia
INFO: finish 
INFO: No pgs_card detected, so not run pgs 
  === Results Summary for run: m_600_0.8_10k tag: tag_1 ===

     Cross-section :   0.01641 +- 4.034e-05 pb
     Nb of events :  10000
 
INFO: storring files of Previous run 
INFO: Storing Pythia files of Previous run 
INFO: Done 
quit
INFO:  
 
INFO:  
 
launch in debug mode

Test: Calculation of r = signal/(95%CL limit on signal)
Warning: Error is dominated by Monte Carlo statistics!
Result: Excluded
Result for r: r_max = 1.21871
SR: atlas_1405_7875 - SR05_d.6jt+
Traceback (most recent call last):
  File "get_checkmate_results.py", line 7, in <module>
    ld = open("/Users/yoshi/packages/checkmate_v1.2.1/results/output/evaluation/best_signal_regions.txt")
IOError: [Errno 2] No such file or directory: '/Users/yoshi/packages/checkmate_v1.2.1/results/output/evaluation/best_signal_regions.txt'
cat: s.tmp: No such file or directory
mkdir: cannot create directory `results_local_test/atlas_1405_7875_600': No such file or directory
mv: cannot move `/home/yoshitar/packages/CheckMATE-1.2.2/results/output' to `results_local_test/atlas_1405_7875_600/zw': No such file or directory
mv: cannot move `s_zw.dat' to `results_local_test/atlas_1405_7875_600/.': No such file or directory
************************************************************
*                                                          *
*                      W E L C O M E to                    *
*             M A D G R A P H 5 _ a M C @ N L O            *
*                      M A D E V E N T                     *
*                                                          *
*                 *                       *                *
*                   *        * *        *                  *
*                     * * * * 5 * * * *                    *
*                   *        * *        *                  *
*                 *                       *                *
*                                                          *
*         VERSION 5.2.3.0.beta                             *
*                                                          *
*    The MadGraph5_aMC@NLO Development Team - Find us at   *
*    https://server06.fynu.ucl.ac.be/projects/madgraph     *
*                                                          *
*               Type 'help' for in-line help.              *
*                                                          *
************************************************************
INFO: load configuration from /home/yoshitar/projects/z2j/MG5/pp_bpbp~_uw-u~w+/Cards/me5_configuration.txt  
INFO: load configuration from /home/yoshitar/packages/MG5_aMC_v2.3.0.beta/input/mg5_configuration.txt  
INFO: load configuration from /home/yoshitar/projects/z2j/MG5/pp_bpbp~_uw-u~w+/Cards/me5_configuration.txt  
Using default text editor "vi". Set another one in ./input/mg5_configuration.txt
Using default eps viewer "evince". Set another one in ./input/mg5_configuration.txt
Using default web browser "firefox". Set another one in ./input/mg5_configuration.txt
No valid Delphes path found
generate_events m_600_0.8_10k -f
INFO: Computing the width set on auto in the param_card.dat 
INFO: load particles 
INFO: load vertices 
INFO: Change particles name to pass to MG5 convention 
************************************************************
*                                                          *
*                     W E L C O M E to                     *
*              M A D G R A P H 5 _ a M C @ N L O           *
*                                                          *
*                                                          *
*                 *                       *                *
*                   *        * *        *                  *
*                     * * * * 5 * * * *                    *
*                   *        * *        *                  *
*                 *                       *                *
*                                                          *
*         VERSION 2.3.0.beta            2015-04-10         *
*                                                          *
*    The MadGraph5_aMC@NLO Development Team - Find us at   *
*    https://server06.fynu.ucl.ac.be/projects/madgraph     *
*                            and                           *
*            http://amcatnlo.web.cern.ch/amcatnlo/         *
*                                                          *
*               Type 'help' for in-line help.              *
*           Type 'tutorial' to learn how MG5 works         *
*    Type 'tutorial aMCatNLO' to learn how aMC@NLO works   *
*    Type 'tutorial MadLoop' to learn how MadLoop works    *
*                                                          *
************************************************************
load MG5 configuration from ../../../../packages/MG5_aMC_v2.3.0.beta/input/mg5_configuration.txt 
set fastjet to fastjet-config
set lhapdf to lhapdf-config
Using default text editor "vi". Set another one in ./input/mg5_configuration.txt
Using default eps viewer "evince". Set another one in ./input/mg5_configuration.txt
Using default web browser "firefox". Set another one in ./input/mg5_configuration.txt
set automatic_html_opening False --no_save
compute_widths 6000007 --precision_channel=0.01 --body_decay=4.0025 --path=/home/yoshitar/projects/z2j/MG5/pp_bpbp~_uw-u~w+/Cards/param_card.dat --output=/home/yoshitar/projects/z2j/MG5/pp_bpbp~_uw-u~w+/Cards/param_card.dat
[1;34mBe carefull automatic computation of the width is
ONLY valid in Narrow-Width Approximation and at Tree-Level.[0m
INFO: get decay diagram for bp 
Vertexlist of this model has not been searched.Automatically run the model.find_vertexlist()
Found 1 stable particles
Pass to numerical integration for computing the widths:
INFO: More info in temporary files:
    /home/yoshitar/projects/z2j/MG5/pp_bpbp~_uw-u~w+/tmp9ySZtC/temp_decay/index.html 
Results written to /home/yoshitar/projects/z2j/MG5/pp_bpbp~_uw-u~w+/Cards/param_card.dat
Generating 10000 events with run name m_600_0.8_10k
survey  m_600_0.8_10k 
INFO: compile directory 
compile Source Directory
Error: no display specified
Using random number seed offset = 21
INFO: Running Survey 
Creating Jobs
Working on SubProcesses
INFO:     P0_gg_bpbpx_bp_qwm_bpx_qwp  
INFO:     P0_qq_bpbpx_bp_qwm_bpx_qwp  
INFO:  Idle: 0,  Running: 2,  Completed: 0 [ current time: 22h33 ] 
INFO:  Idle: 0,  Running: 1,  Completed: 1 [  2.8s  ] 
INFO:  Idle: 0,  Running: 0,  Completed: 2 [  3s  ] 
INFO: End survey 
refine 10000
Creating Jobs
INFO: Refine results to 10000 
INFO: Generating 10000.0 unweigthed events. 
INFO: Effective Luminosity 1021928.0205 pb^-1 
INFO: need to improve 3 channels 
Current estimate of cross-section: 0.01174251 +- 0.00298269060461
    P0_gg_bpbpx_bp_qwm_bpx_qwp 
    P0_qq_bpbpx_bp_qwm_bpx_qwp 
INFO:  Idle: 1,  Running: 2,  Completed: 0 [ current time: 22h34 ] 
INFO:  Idle: 0,  Running: 2,  Completed: 1 [  4.4s  ] 
INFO:  Idle: 0,  Running: 1,  Completed: 2 [  16.5s  ] 
INFO:  Idle: 0,  Running: 0,  Completed: 3 [  5m 52s  ] 
INFO:  Idle: 0,  Running: 0,  Completed: 3 [  5m 52s  ] 
INFO: Combining runs 
INFO: finish refine 
refine 10000
Creating Jobs
INFO: Refine results to 10000 
INFO: Generating 10000.0 unweigthed events. 
INFO: Effective Luminosity 1105445.70189 pb^-1 
INFO: need to improve 0 channels 
Current estimate of cross-section: 0.01085535 +- 2.23778014836e-05
    P0_gg_bpbpx_bp_qwm_bpx_qwp 
    P0_qq_bpbpx_bp_qwm_bpx_qwp 
INFO:  Idle: 0,  Running: 0,  Completed: 0 [ current time: 22h39 ] 
INFO: Combining runs 
INFO: finish refine 
combine_events
INFO: Combining Events 
  === Results Summary for run: m_600_0.8_10k tag: tag_1 ===

     Cross-section :   0.01086 +- 2.238e-05 pb
     Nb of events :  10000
 
running syscalc on mode parton
store_events
INFO: Storing parton level results 
INFO: End Parton 
reweight -from_cards
decay_events -from_cards
INFO: Running Pythia 
INFO: Creating shower LHE File (for plot) 
INFO: Warning! Never use this lhe file for detector studies! 
running syscalc on mode Pythia
INFO: finish 
INFO: No pgs_card detected, so not run pgs 
  === Results Summary for run: m_600_0.8_10k tag: tag_1 ===

     Cross-section :   0.01086 +- 2.238e-05 pb
     Nb of events :  10000
 
INFO: storring files of Previous run 
INFO: Storing Pythia files of Previous run 
INFO: Done 
quit
INFO:  
 
INFO:  
 
launch in debug mode

Test: Calculation of r = signal/(95%CL limit on signal)
Warning: Error is dominated by Monte Carlo statistics!
Warning: The model could be excluded if you provided more input events!
Result: Allowed
Result for r: r_max = 0.73046
SR: atlas_1405_7875 - SR05_d.6jt+
Traceback (most recent call last):
  File "get_checkmate_results.py", line 7, in <module>
    ld = open("/Users/yoshi/packages/checkmate_v1.2.1/results/output/evaluation/best_signal_regions.txt")
IOError: [Errno 2] No such file or directory: '/Users/yoshi/packages/checkmate_v1.2.1/results/output/evaluation/best_signal_regions.txt'
cat: s.tmp: No such file or directory
mkdir: cannot create directory `results_local_test/atlas_1405_7875_600': No such file or directory
mv: cannot move `/home/yoshitar/packages/CheckMATE-1.2.2/results/output' to `results_local_test/atlas_1405_7875_600/ww': No such file or directory
mv: cannot move `s_ww.dat' to `results_local_test/atlas_1405_7875_600/.': No such file or directory
cat: results_local_test/atlas_1405_7875_600/s_zz.dat: No such file or directory
cat: results_local_test/atlas_1405_7875_600/s_zw.dat: No such file or directory
cat: results_local_test/atlas_1405_7875_600/s_ww.dat: No such file or directory
(standard_in) 1: syntax error
(standard_in) 1: syntax error
(standard_in) 1: syntax error
(standard_in) 1: syntax error
(standard_in) 1: syntax error
(standard_in) 1: syntax error
(standard_in) 1: syntax error
600
